{
  "$schema": "https://json-schema.org/draft/2020-12/schema",
  "$id": "pred-contrato/v1/engine_capabilities.schema.json",
  "$defs": {
    "Availability": {
      "additionalProperties": false,
      "description": "Si el dato existe hoy. Sostiene estados vacios y acciones deshabilitadas.",
      "properties": {
        "status": {
          "enum": [
            "available",
            "unavailable"
          ],
          "title": "Status",
          "type": "string"
        },
        "reason_code": {
          "anyOf": [
            {
              "enum": [
                "no_data",
                "engine_gap",
                "stage_not_implemented",
                "prerequisite_missing"
              ],
              "type": "string"
            },
            {
              "type": "null"
            }
          ],
          "default": null,
          "title": "Reason Code"
        },
        "blocked_by": {
          "items": {
            "pattern": "^G[1-8]$",
            "type": "string"
          },
          "title": "Blocked By",
          "type": "array"
        },
        "detail": {
          "anyOf": [
            {
              "type": "string"
            },
            {
              "type": "null"
            }
          ],
          "default": null,
          "title": "Detail"
        }
      },
      "required": [
        "status"
      ],
      "title": "Availability",
      "type": "object"
    },
    "Capability": {
      "additionalProperties": false,
      "properties": {
        "id": {
          "enum": [
            "parquet_read",
            "ingest_report_persisted",
            "topology_persisted",
            "family_comparison",
            "selection_results_persisted",
            "trial_detail_persisted",
            "walkforward_evidence_persisted",
            "run_state_persisted",
            "champion_selection",
            "retrospective_validation",
            "synthetic_log_read"
          ],
          "title": "Id",
          "type": "string"
        },
        "available": {
          "title": "Available",
          "type": "boolean"
        },
        "reason_code": {
          "anyOf": [
            {
              "enum": [
                "engine_gap",
                "stage_not_implemented"
              ],
              "type": "string"
            },
            {
              "type": "null"
            }
          ],
          "default": null,
          "title": "Reason Code"
        },
        "blocked_by": {
          "items": {
            "pattern": "^G[1-8]$",
            "type": "string"
          },
          "title": "Blocked By",
          "type": "array"
        }
      },
      "required": [
        "id",
        "available"
      ],
      "title": "Capability",
      "type": "object"
    }
  },
  "additionalProperties": false,
  "properties": {
    "schema_version": {
      "pattern": "^1\\.[0-9]+\\.[0-9]+$",
      "title": "Schema Version",
      "type": "string"
    },
    "generated_at": {
      "format": "date-time",
      "title": "Generated At",
      "type": "string"
    },
    "source": {
      "enum": [
        "engine",
        "fixture"
      ],
      "title": "Source",
      "type": "string"
    },
    "availability": {
      "$ref": "#/$defs/Availability"
    },
    "items": {
      "items": {
        "$ref": "#/$defs/Capability"
      },
      "title": "Items",
      "type": "array"
    }
  },
  "required": [
    "schema_version",
    "generated_at",
    "source",
    "availability",
    "items"
  ],
  "title": "EngineCapabilities",
  "type": "object",
  "x-contract-version": "1.0.0"
}
